{
  "schemaVersion": "1.0.0",
  "catalogVersion": "2026.09.27.1",
  "generatedAt": "2026-09-27T00:00:00+09:00",
  "items": [
    {
      "id": "sample_rule_card_a_base",
      "name": "サンプルカードA 基本還元（150円につき1pt）",
      "description": "",
      "ruleKind": "baseReward",
      "selectors": {
        "instrumentIds": ["sample_card_a"],
        "modeIds": [],
        "routeIds": [],
        "fundingRelationIds": [],
        "merchantIds": [],
        "merchantGroupIds": [],
        "categoryIds": [],
        "brandIds": [],
        "locationIds": [],
        "transactionTags": []
      },
      "exclusions": {
        "instrumentIds": [],
        "modeIds": [],
        "routeIds": [],
        "fundingRelationIds": [],
        "merchantIds": [],
        "merchantGroupIds": [],
        "categoryIds": [],
        "brandIds": [],
        "locationIds": [],
        "transactionTags": []
      },
      "conditionExpression": null,
      "calculation": {
        "calculationType": "unitPoints",
        "amountUnitYen": 150,
        "pointsPerUnit": 1,
        "rounding": "towardZero"
      },
      "outputPointProgramId": "sample_point",
      "aggregation": {
        "scope": "transaction",
        "aggregationKey": null,
        "periodMinimumEligibleSpendYen": 0,
        "conditionEvaluationTiming": "transaction",
        "incrementalAward": false
      },
      "stacking": {
        "policy": "stackable",
        "exclusiveGroupId": null,
        "replacesRuleIds": [],
        "suppressesRuleIds": [],
        "suppressesTags": [],
        "dependsOnRuleIds": [],
        "applicationOrder": 10
      },
      "cap": null,
      "validFrom": "2000-01-01",
      "validUntilExclusive": null,
      "dateBasis": "transactionDate",
      "timezone": "Asia/Tokyo",
      "displayClaim": null,
      "sourceIds": ["sample_source_official"],
      "lastVerifiedAt": "2026-09-01",
      "status": "active",
      "priority": 100,
      "tags": ["base"],
      "notes": []
    },
    {
      "id": "sample_rule_card_a_monthly",
      "name": "サンプルカードA 月間合算（1000円につき1pt）",
      "description": "",
      "ruleKind": "baseReward",
      "selectors": {
        "instrumentIds": ["sample_card_a"],
        "modeIds": [],
        "routeIds": [],
        "fundingRelationIds": [],
        "merchantIds": [],
        "merchantGroupIds": [],
        "categoryIds": [],
        "brandIds": [],
        "locationIds": [],
        "transactionTags": []
      },
      "exclusions": {
        "instrumentIds": [],
        "modeIds": [],
        "routeIds": [],
        "fundingRelationIds": [],
        "merchantIds": [],
        "merchantGroupIds": [],
        "categoryIds": [],
        "brandIds": [],
        "locationIds": [],
        "transactionTags": []
      },
      "conditionExpression": null,
      "calculation": {
        "calculationType": "unitPoints",
        "amountUnitYen": 1000,
        "pointsPerUnit": 1,
        "rounding": "floor"
      },
      "outputPointProgramId": "sample_point",
      "aggregation": {
        "scope": "calendarMonth",
        "aggregationKey": "sample_monthly_key",
        "periodMinimumEligibleSpendYen": 0,
        "conditionEvaluationTiming": "transaction",
        "incrementalAward": true
      },
      "stacking": {
        "policy": "stackable",
        "exclusiveGroupId": null,
        "replacesRuleIds": [],
        "suppressesRuleIds": [],
        "suppressesTags": [],
        "dependsOnRuleIds": [],
        "applicationOrder": 15
      },
      "cap": null,
      "validFrom": "2000-01-01",
      "validUntilExclusive": null,
      "dateBasis": "transactionDate",
      "timezone": "Asia/Tokyo",
      "displayClaim": null,
      "sourceIds": ["sample_source_official"],
      "lastVerifiedAt": "2026-09-01",
      "status": "active",
      "priority": 90,
      "tags": ["monthly"],
      "notes": []
    },
    {
      "id": "sample_rule_card_b_rate",
      "name": "サンプルカードB 基本還元（1%）",
      "description": "",
      "ruleKind": "baseReward",
      "selectors": {
        "instrumentIds": ["sample_card_b"],
        "modeIds": [],
        "routeIds": [],
        "fundingRelationIds": [],
        "merchantIds": [],
        "merchantGroupIds": [],
        "categoryIds": [],
        "brandIds": [],
        "locationIds": [],
        "transactionTags": []
      },
      "exclusions": {
        "instrumentIds": [],
        "modeIds": [],
        "routeIds": [],
        "fundingRelationIds": [],
        "merchantIds": [],
        "merchantGroupIds": [],
        "categoryIds": [],
        "brandIds": [],
        "locationIds": [],
        "transactionTags": []
      },
      "conditionExpression": null,
      "calculation": {
        "calculationType": "rateFraction",
        "numerator": 1,
        "denominator": 100,
        "rounding": "towardZero"
      },
      "outputPointProgramId": "sample_point",
      "aggregation": {
        "scope": "transaction",
        "aggregationKey": null,
        "periodMinimumEligibleSpendYen": 0,
        "conditionEvaluationTiming": "transaction",
        "incrementalAward": false
      },
      "stacking": {
        "policy": "stackable",
        "exclusiveGroupId": null,
        "replacesRuleIds": [],
        "suppressesRuleIds": [],
        "suppressesTags": [],
        "dependsOnRuleIds": [],
        "applicationOrder": 20
      },
      "cap": null,
      "validFrom": "2000-01-01",
      "validUntilExclusive": null,
      "dateBasis": "transactionDate",
      "timezone": "Asia/Tokyo",
      "displayClaim": "最大5%還元（広告表記のサンプル）",
      "sourceIds": ["sample_source_official"],
      "lastVerifiedAt": "2026-09-01",
      "status": "active",
      "priority": 100,
      "tags": ["base"],
      "notes": []
    },
    {
      "id": "sample_rule_card_c_base",
      "name": "サンプルカードC 基本還元（固定5pt）",
      "description": "",
      "ruleKind": "baseReward",
      "selectors": {
        "instrumentIds": ["sample_card_c"],
        "modeIds": [],
        "routeIds": [],
        "fundingRelationIds": [],
        "merchantIds": [],
        "merchantGroupIds": [],
        "categoryIds": [],
        "brandIds": [],
        "locationIds": [],
        "transactionTags": []
      },
      "exclusions": {
        "instrumentIds": [],
        "modeIds": [],
        "routeIds": [],
        "fundingRelationIds": [],
        "merchantIds": [],
        "merchantGroupIds": [],
        "categoryIds": [],
        "brandIds": [],
        "locationIds": [],
        "transactionTags": []
      },
      "conditionExpression": null,
      "calculation": { "calculationType": "fixedPoints", "points": 5 },
      "outputPointProgramId": "sample_point",
      "aggregation": {
        "scope": "transaction",
        "aggregationKey": null,
        "periodMinimumEligibleSpendYen": 0,
        "conditionEvaluationTiming": "transaction",
        "incrementalAward": false
      },
      "stacking": {
        "policy": "stackable",
        "exclusiveGroupId": null,
        "replacesRuleIds": [],
        "suppressesRuleIds": [],
        "suppressesTags": [],
        "dependsOnRuleIds": [],
        "applicationOrder": 30
      },
      "cap": null,
      "validFrom": "2000-01-01",
      "validUntilExclusive": null,
      "dateBasis": "transactionDate",
      "timezone": "Asia/Tokyo",
      "displayClaim": null,
      "sourceIds": ["sample_source_official"],
      "lastVerifiedAt": "2026-09-01",
      "status": "active",
      "priority": 100,
      "tags": ["base"],
      "notes": []
    },
    {
      "id": "sample_rule_card_c_conditional",
      "name": "サンプルカードC 条件付き上乗せ（未入力条件）",
      "description": "",
      "ruleKind": "campaignBonus",
      "selectors": {
        "instrumentIds": ["sample_card_c"],
        "modeIds": [],
        "routeIds": [],
        "fundingRelationIds": [],
        "merchantIds": [],
        "merchantGroupIds": [],
        "categoryIds": [],
        "brandIds": [],
        "locationIds": [],
        "transactionTags": []
      },
      "exclusions": {
        "instrumentIds": [],
        "modeIds": [],
        "routeIds": [],
        "fundingRelationIds": [],
        "merchantIds": [],
        "merchantGroupIds": [],
        "categoryIds": [],
        "brandIds": [],
        "locationIds": [],
        "transactionTags": []
      },
      "conditionExpression": {
        "nodeType": "condition",
        "conditionId": "sample_condition_unset"
      },
      "calculation": { "calculationType": "fixedPoints", "points": 1000 },
      "outputPointProgramId": "sample_point",
      "aggregation": {
        "scope": "transaction",
        "aggregationKey": null,
        "periodMinimumEligibleSpendYen": 0,
        "conditionEvaluationTiming": "transaction",
        "incrementalAward": false
      },
      "stacking": {
        "policy": "stackable",
        "exclusiveGroupId": null,
        "replacesRuleIds": [],
        "suppressesRuleIds": [],
        "suppressesTags": [],
        "dependsOnRuleIds": [],
        "applicationOrder": 40
      },
      "cap": null,
      "validFrom": "2000-01-01",
      "validUntilExclusive": null,
      "dateBasis": "transactionDate",
      "timezone": "Asia/Tokyo",
      "displayClaim": null,
      "sourceIds": ["sample_source_official"],
      "lastVerifiedAt": "2026-09-01",
      "status": "active",
      "priority": 50,
      "tags": ["campaign"],
      "notes": []
    }
  ]
}
