{
  "schemaVersion": "1.0.0",
  "catalogVersion": "2026.09.27.1",
  "generatedAt": "2026-09-27T00:00:00+09:00",
  "items": [
    {
      "id": "sample_card_a",
      "name": "サンプルカードA",
      "shortName": "サンプルA",
      "instrumentType": "creditCard",
      "issuerName": "サンプル発行会社A",
      "partnerInstitutionName": null,
      "availableBrandIds": [],
      "annualFee": 0,
      "supportedModeIds": [],
      "supportedRouteIds": [],
      "validFrom": "2000-01-01",
      "validUntilExclusive": null,
      "status": "active",
      "sourceIds": ["sample_source_official"],
      "lastVerifiedAt": "2026-09-01",
      "displayClaims": [],
      "tags": [],
      "notes": []
    },
    {
      "id": "sample_card_b",
      "name": "サンプルカードB",
      "shortName": "サンプルB",
      "instrumentType": "creditCard",
      "issuerName": "サンプル発行会社B",
      "partnerInstitutionName": null,
      "availableBrandIds": [],
      "annualFee": 5000,
      "supportedModeIds": [],
      "supportedRouteIds": [],
      "validFrom": "2000-01-01",
      "validUntilExclusive": null,
      "status": "active",
      "sourceIds": [],
      "lastVerifiedAt": "2026-09-01",
      "displayClaims": ["最大5%還元（広告表記のサンプル）"],
      "tags": [],
      "notes": []
    },
    {
      "id": "sample_card_c",
      "name": "サンプルカードC",
      "shortName": "サンプルC",
      "instrumentType": "debitCard",
      "issuerName": "サンプル発行会社C",
      "partnerInstitutionName": null,
      "availableBrandIds": [],
      "annualFee": 0,
      "supportedModeIds": [],
      "supportedRouteIds": [],
      "validFrom": "2000-01-01",
      "validUntilExclusive": null,
      "status": "active",
      "sourceIds": [],
      "lastVerifiedAt": "2026-09-01",
      "displayClaims": [],
      "tags": [],
      "notes": []
    }
  ]
}
